{
  "schema_version": "keyword-catalog.v1",
  "ruleset": {
    "core": "2026-10-09",
    "faq_as_of": "2026-08-14"
  },
  "status": "draft",
  "entries": [
    {
      "keyword_id": "accelerate",
      "name": "Accelerate",
      "locators": [
        "Core 805.1.a",
        "Core 805.2",
        "Core 805.4"
      ],
      "production": {
        "module": "play_transaction",
        "symbol": "accelerate_offer",
        "layer": "cost",
        "note": "805.1.b offers an optional [1][C] additional cost while the unit is played, and a paid one makes it enter ready; the offer joins the declared optional costs before the intent loop, so it needs the same explicit choice, and paying writes the 805.2.b delayed replacement bound to this card and this play"
      },
      "active_zone": "chain",
      "boundary": {
        "identity": "bound to the card that paid and the play that paid it, so losing the keyword afterwards does not take the ready entry back (805.2.b)",
        "duration": "for that play only; on the board Accelerate does nothing (805.3)"
      },
      "review": {
        "reviewer": "claude",
        "date": "2026-09-08",
        "source": "Core Rules 2026-07-16 (locators renumbered to 2026-10-09 in C3) rule 805, quoted in the gate; the production was verified against the live play transaction and the enumeration, which read the same offer"
      },
      "fixture": "check_accelerate.py"
    },
    {
      "keyword_id": "ambush",
      "name": "Ambush",
      "locators": [
        "Core 822.1",
        "Core 822.3"
      ],
      "production": {
        "module": "play_transaction",
        "symbol": "play_card",
        "layer": "timing",
        "note": "a play permission plus Reaction while the Unit is being played to a Battlefield where its controller has Units"
      },
      "active_zone": "chain",
      "boundary": {
        "identity": "re-derived at commit",
        "duration": "for that play only"
      },
      "review": {
        "reviewer": "claude",
        "date": "2026-09-07",
        "source": "Core Rules 2026-07-16 (locators renumbered to 2026-10-09 in C3); the production was verified against the live engine, the locator against the engine's existing citations"
      },
      "fixture": "check_play_sources.py"
    },
    {
      "keyword_id": "assault",
      "name": "Assault",
      "locators": [
        "Core 807.1.b",
        "Core 807.1.c",
        "Core 807.2"
      ],
      "production": {
        "module": "effect_ir",
        "symbol": "assault_total",
        "layer": "ability",
        "note": "printed or granted in the Ability layer and summed; it adds to Might only while the Unit is an Attacker (807.1.c)"
      },
      "active_zone": "board",
      "boundary": {
        "identity": "bound to the object identity it was granted to (124)",
        "duration": "printed, or this turn / this combat when granted"
      },
      "review": {
        "reviewer": "claude",
        "date": "2026-09-22",
        "source": "Core Rules 2026-07-16 (locators renumbered to 2026-10-09 in C3) 807; the production was verified against the live engine (check_assault.py)"
      },
      "fixture": "check_assault.py"
    },
    {
      "keyword_id": "backline",
      "name": "Backline",
      "locators": [
        "Core 815.1.c",
        "Core 467.2.c.6-467.2.c.9"
      ],
      "production": {
        "module": "combat",
        "symbol": "assignment_candidates",
        "layer": "procedure"
      },
      "active_zone": "board",
      "boundary": {
        "identity": "the Unit's current designation",
        "duration": "while the Combat lasts"
      },
      "review": {
        "reviewer": "claude",
        "date": "2026-09-07",
        "source": "Core Rules 2026-07-16 (locators renumbered to 2026-10-09 in C3); the production was verified against the live engine, the locator against the engine's existing citations"
      },
      "fixture": "check_combat_damage_assignment.py"
    },
    {
      "keyword_id": "deathknell",
      "name": "Deathknell",
      "locators": [
        "Core 808.1",
        "Core 808.2",
        "Core 808.3",
        "Core 383.2.c.3"
      ],
      "production": {
        "module": "effect_ir",
        "symbol": "deathknell_instances",
        "layer": "ability",
        "note": "808.2 makes \"[Deathknell][>] [Effect]\" short for \"When I die, [Effect]\", so the ability is the object's death trigger; the Kill path notes the instances before the card moves to the Trash (323 step 3a) and marks each separately, because 808.3 triggers each instance on its own"
      },
      "active_zone": "board",
      "boundary": {
        "identity": "read from the computed characteristics, so a granted or copied Deathknell counts",
        "duration": "while the permanent is on the board; the trigger is noted before it reaches the Trash"
      },
      "review": {
        "reviewer": "claude",
        "date": "2026-09-08",
        "source": "Core Rules 2026-07-16 (locators renumbered to 2026-10-09 in C3) rule 808 and Cleanup step 3a; the production was verified against the live engine's death-trigger path, the locators against the rule text quoted in the gate"
      },
      "fixture": "check_deathknell.py"
    },
    {
      "keyword_id": "deflect",
      "name": "Deflect",
      "locators": [
        "Core 809.1.b",
        "Core 809.1.c",
        "Core 809.1.d",
        "Core 809.2"
      ],
      "production": {
        "module": "play_transaction",
        "symbol": "deflect_costs",
        "layer": "cost",
        "note": "each time an opposing-team spell or ability chooses the object, a mandatory any-domain Power cost"
      },
      "active_zone": "board",
      "boundary": {
        "identity": "the object chosen at play",
        "duration": "per choice"
      },
      "review": {
        "reviewer": "claude",
        "date": "2026-09-07",
        "source": "Core Rules 2026-07-16 (locators renumbered to 2026-10-09 in C3); the production was verified against the live engine, the locator against the engine's existing citations"
      },
      "fixture": "check_deflect.py"
    },
    {
      "keyword_id": "empower",
      "name": "Empower",
      "locators": [
        "Core 442",
        "Core 827.1",
        "Core 827.2"
      ],
      "production": {
        "module": "effect_ir",
        "symbol": "_apply_one",
        "layer": "procedure",
        "note": "the Empower action sets the binary state and refuses a second application (442.1.b, 442.1.c.1); P5 emits the become_empowered event (442.2.a)"
      },
      "active_zone": "board",
      "boundary": {
        "identity": "the object's Empowered state",
        "duration": "until it is disempowered"
      },
      "review": {
        "reviewer": "claude",
        "date": "2026-09-07",
        "source": "Core Rules 2026-07-16 (locators renumbered to 2026-10-09 in C3); the production was verified against the live engine, the locator against the engine's existing citations"
      },
      "fixture": "check_empower_xp.py"
    },
    {
      "keyword_id": "equip",
      "name": "Equip",
      "locators": [
        "Core 818.1",
        "Core 819"
      ],
      "production": null,
      "active_zone": "board",
      "boundary": {
        "identity": "the Equipment and its host",
        "duration": "while attached"
      },
      "review": {
        "reviewer": "claude",
        "date": "2026-09-07",
        "source": "Core Rules 2026-07-16 (locators renumbered to 2026-10-09 in C3); the production was verified against the live engine, the locator against the engine's existing citations"
      }
    },
    {
      "keyword_id": "ganking",
      "name": "Ganking",
      "locators": [
        "Core 810.1",
        "Core 810.1.b",
        "Core 810.1.c",
        "Core 144.4.c"
      ],
      "production": {
        "module": "combat",
        "symbol": "standard_move",
        "layer": "procedure",
        "note": "adds Battlefield-to-Battlefield to the Standard Move's valid destinations and nothing else"
      },
      "active_zone": "board",
      "boundary": {
        "identity": "read at the moment of the Move",
        "duration": "while the Unit has it"
      },
      "review": {
        "reviewer": "claude",
        "date": "2026-09-07",
        "source": "Core Rules 2026-07-16 (locators renumbered to 2026-10-09 in C3); the production was verified against the live engine, the locator against the engine's existing citations"
      },
      "fixture": "check_standard_move.py"
    },
    {
      "keyword_id": "hidden",
      "name": "Hidden",
      "locators": [
        "Core 811",
        "Core 811.1",
        "Core 811.2",
        "Core 811.4"
      ],
      "production": {
        "module": "hidden",
        "symbol": "hide_card",
        "layer": "procedure",
        "note": "the prerequisite of the Hide Discretionary Action; playing from the Facedown Zone is a play source"
      },
      "active_zone": "hand_or_champion_zone",
      "boundary": {
        "identity": "the card becomes a new object when hidden (124)",
        "duration": "while it stays in the Facedown Zone"
      },
      "review": {
        "reviewer": "claude",
        "date": "2026-09-07",
        "source": "Core Rules 2026-07-16 (locators renumbered to 2026-10-09 in C3); the production was verified against the live engine, the locator against the engine's existing citations"
      },
      "fixture": "check_hidden.py"
    },
    {
      "keyword_id": "hunt",
      "name": "Hunt",
      "locators": [
        "Core 823.1",
        "Core 823.1.c",
        "Core 823.2"
      ],
      "production": null,
      "active_zone": "board",
      "boundary": {
        "identity": "the Unit that Conquers or Holds",
        "duration": "per Score event"
      },
      "review": {
        "reviewer": "claude",
        "date": "2026-09-07",